USER_SESSION_ID,snippets,kotzbox,guess_hypothesis,issues
6998b38b9e9f4c069aaf4999b68014df,"['concatlists.semantic.single.html', 'histogram.semantic.abbrev.html', 'parsequerystring.semantic.normal.html', 'countchildren.syntactic.abbrev.html', 'codestructure.syntactic.single.html', 'readini.syntactic.normal.html']",,Wie verschiedene Personen Code lesen,
8462cc5900c344efb2dd7dabc36a6eec,"['histogram.semantic.normal.html', 'parsequerystring.semantic.single.html', 'concatlists.semantic.abbrev.html', 'codestructure.syntactic.abbrev.html', 'countchildren.syntactic.normal.html', 'readini.syntactic.single.html']","Das war interessant, ich bin an den Ergebnissen interessiert.","Ich denke, dass die Lesbarkeit von Source Code untersucht wurde. Ich kann mir vorstellen, dass unter anderem im Nachhinein ausgewertet wird, wir lange für die Korrekturen benötigt wurde und wie oft der Proband dabei zu den Kommentaren navigieren musste. Dies kann man z.B. in Verhältnis zu der Aussagekraft der verwendeten Codebeispiele und Variablen- und Methodennamen setzen.",
837905f2669f4d3d81d1ca47939e8e0f,"['histogram.semantic.normal.html', 'parsequerystring.semantic.single.html', 'concatlists.semantic.abbrev.html', 'codestructure.syntactic.abbrev.html', 'countchildren.syntactic.normal.html', 'readini.syntactic.single.html']",,WIe lange es dauert bis jemand wegen der schlechten Codequalität von alleine aufgibt...,
343d7276559c433db75135cd8057bc03,"['parsequerystring.semantic.normal.html', 'histogram.semantic.abbrev.html', 'concatlists.semantic.single.html', 'readini.syntactic.single.html', 'codestructure.syntactic.normal.html', 'countchildren.syntactic.abbrev.html']",s.o.,Ich denke sie suchen einen Technischen Assistenten ;-),Studie auf Handy nicht bearbeitbar!
a4d27d625ae84572b00e8c7f88a7e23c,"['parsequerystring.semantic.normal.html', 'histogram.semantic.abbrev.html', 'concatlists.semantic.single.html', 'readini.syntactic.single.html', 'codestructure.syntactic.normal.html', 'countchildren.syntactic.abbrev.html']",,Der Einfluss von Lesbarkeit und klarer Namensgebung auf das einfache Verstehen und finden von Fehlern im Code,
